[
  {
    "id": "orbita4-do16-mogutin-1990",
    "source": "youtube",
    "sourceUrl": "https://t.me/s/orbita_4/248",
    "youtubeVideoId": "1folygclSzY",
    "title": "...до 16 и старше: интервью Ярослава Могутина, 1990",
    "year": 1990,
    "channel": "ЦТ",
    "category": "kids",
    "tags": ["ЦТ", "до 16 и старше", "Ярослав Могутин", "молодежное ТВ"],
    "curatorNote": "Публичный пост Орбиты-4 с YouTube-ссылкой и описанием эфира.",
    "rightsRisk": "high",
    "status": "candidate"
  },
  {
    "id": "orbita4-before-midnight-children-1991",
    "source": "youtube",
    "sourceUrl": "https://t.me/s/orbita_4/288",
    "youtubeVideoId": "ME8HV4zk5YI",
    "title": "До и после полуночи: ровесники перестройки, 30 марта 1991",
    "year": 1991,
    "airDate": "1991-03-30",
    "channel": "ЦТ",
    "category": "documentary",
    "tags": ["ЦТ", "До и после полуночи", "перестройка", "дети"],
    "curatorNote": "Публичный пост Орбиты-4 с YouTube-ссылкой и датой эфира.",
    "rightsRisk": "high",
    "status": "candidate"
  },
  {
    "id": "orbita4-2x2-fragment-1991",
    "source": "youtube",
    "sourceUrl": "https://t.me/s/orbita_4/298",
    "youtubeVideoId": "JHZzh46pTPE",
    "title": "Фрагмент эфира 2x2: реклама, заставки и музыка, ноябрь 1991",
    "year": 1991,
    "channel": "2x2",
    "category": "idents",
    "tags": ["2x2", "реклама", "заставки", "музыка"],
    "curatorNote": "Публичный пост Орбиты-4 с YouTube-ссылкой и описанием фрагмента эфира.",
    "rightsRisk": "high",
    "status": "candidate"
  },
  {
    "id": "orbita4-evdokimov-kobzon-1991",
    "source": "youtube",
    "sourceUrl": "https://t.me/s/orbita_4/238",
    "youtubeVideoId": "tPp0o4Ww0Fg",
    "title": "Михаил Евдокимов: пародия на Иосифа Кобзона, 1991",
    "year": 1991,
    "channel": "ТВ",
    "category": "comedy",
    "tags": ["эстрада", "Михаил Евдокимов", "Иосиф Кобзон", "пародия"],
    "curatorNote": "Публичный пост Орбиты-4 с YouTube-ссылкой.",
    "rightsRisk": "high",
    "status": "candidate"
  },
  {
    "id": "orbita4-delo-parfenov-1992",
    "source": "youtube",
    "sourceUrl": "https://t.me/s/orbita_4/277",
    "youtubeVideoId": "JCbiKUZhz6A",
    "title": "Дело: Леонид Парфенов на первом канале Останкино, 1992",
    "year": 1992,
    "channel": "Останкино",
    "category": "documentary",
    "tags": ["Останкино", "Дело", "Леонид Парфенов", "экономика"],
    "curatorNote": "Публичный пост Орбиты-4 с YouTube-ссылкой и описанием программы.",
    "rightsRisk": "high",
    "status": "candidate"
  },
  {
    "id": "orbita4-ostankino-channel4-schedule-1992",
    "source": "youtube",
    "sourceUrl": "https://t.me/s/orbita_4/278",
    "youtubeVideoId": "SO5IbDRgl3s",
    "title": "Программа передач 4-го канала Останкино, 13 декабря 1992",
    "year": 1992,
    "airDate": "1992-12-13",
    "channel": "Останкино",
    "category": "idents",
    "tags": ["Останкино", "4 канал", "программа передач", "диктор"],
    "curatorNote": "Публичный пост Орбиты-4 с YouTube-ссылкой и датой эфира.",
    "rightsRisk": "high",
    "status": "candidate"
  },
  {
    "id": "orbita4-ddt-new-life-1993",
    "source": "youtube",
    "sourceUrl": "https://t.me/s/orbita_4/283",
    "youtubeVideoId": "RrMNDhBvI6E",
    "title": "ДДТ: Новая жизнь, 1 мая 1993",
    "year": 1993,
    "airDate": "1993-05-01",
    "channel": "ТВ",
    "category": "music",
    "tags": ["ДДТ", "Юрий Шевчук", "рок", "музыка"],
    "curatorNote": "Публичный пост Орбиты-4 с YouTube-ссылкой и датой.",
    "rightsRisk": "high",
    "status": "candidate"
  },
  {
    "id": "orbita4-ostankino-october-1993-strelnikov",
    "source": "youtube",
    "sourceUrl": "https://t.me/s/orbita_4/235",
    "youtubeVideoId": "36av4HblDVs",
    "title": "Василий Стрельников о событиях 3 октября 1993 года",
    "year": 1993,
    "airDate": "1993-10-03",
    "channel": "ТВ",
    "category": "talk",
    "tags": ["Останкино", "Василий Стрельников", "1993", "интервью"],
    "curatorNote": "Публичный пост Орбиты-4 с YouTube-ссылкой.",
    "rightsRisk": "high",
    "status": "candidate"
  },
  {
    "id": "orbita4-rotor-spartak-ending-1993",
    "source": "youtube",
    "sourceUrl": "https://t.me/s/orbita_4/296",
    "youtubeVideoId": "4oqVOHFLnhY",
    "title": "Завершение трансляции: Ротор - Спартак, 3 октября 1993",
    "year": 1993,
    "airDate": "1993-10-03",
    "channel": "Останкино",
    "category": "sports",
    "tags": ["Останкино", "футбол", "Ротор", "Спартак"],
    "curatorNote": "Публичный пост Орбиты-4 с YouTube-ссылкой.",
    "rightsRisk": "high",
    "status": "candidate"
  },
  {
    "id": "orbita4-tamtam-news-1993",
    "source": "youtube",
    "sourceUrl": "https://t.me/s/orbita_4/297",
    "youtubeVideoId": "szMZCjovXJM",
    "title": "Там-там новости, 7 октября 1993",
    "year": 1993,
    "airDate": "1993-10-07",
    "channel": "Останкино",
    "category": "kids",
    "tags": ["Останкино", "Там-там новости", "детское ТВ", "новости"],
    "curatorNote": "Публичный пост Орбиты-4 с YouTube-ссылкой и датой выпуска.",
    "rightsRisk": "high",
    "status": "candidate"
  },
  {
    "id": "orbita4-vodka-zver-1993",
    "source": "youtube",
    "sourceUrl": "https://t.me/s/orbita_4/314",
    "youtubeVideoId": "-bcJZldeoIA",
    "title": "Vodka Zver: рекламный ролик, около 1993",
    "year": 1993,
    "channel": "ТВ",
    "category": "ads",
    "tags": ["реклама", "водка Zver", "90-е"],
    "curatorNote": "Публичный пост Орбиты-4 с YouTube-ссылкой; год указан источником приблизительно.",
    "rightsRisk": "high",
    "status": "candidate"
  },
  {
    "id": "orbita4-elizabeth-kremlin-1994",
    "source": "youtube",
    "sourceUrl": "https://t.me/s/orbita_4/317",
    "youtubeVideoId": "iYzRJT_wr9M",
    "title": "Елизавета II на приеме в Кремле, 18 октября 1994",
    "year": 1994,
    "airDate": "1994-10-18",
    "channel": "ТВ",
    "category": "news",
    "tags": ["Елизавета II", "Борис Ельцин", "Кремль", "визит"],
    "curatorNote": "Публичный пост Орбиты-4 с YouTube-ссылкой и датой события.",
    "rightsRisk": "high",
    "status": "candidate"
  },
  {
    "id": "orbita4-bus-hostage-red-square-1995",
    "source": "youtube",
    "sourceUrl": "https://t.me/s/orbita_4/232",
    "youtubeVideoId": "d4x2aEMVayU",
    "title": "Захват автобуса на Красной площади, 14 октября 1995",
    "year": 1995,
    "airDate": "1995-10-14",
    "channel": "ОРТ",
    "category": "news",
    "tags": ["ОРТ", "новости", "Красная площадь", "1995"],
    "curatorNote": "Публичный пост Орбиты-4 с YouTube-ссылкой и описанием репортажа.",
    "rightsRisk": "high",
    "status": "candidate"
  },
  {
    "id": "orbita4-ort-regional-reports-1995",
    "source": "youtube",
    "sourceUrl": "https://t.me/s/orbita_4/233",
    "youtubeVideoId": "vyjbwfoh0Bc",
    "title": "ОРТ: репортажи из Нижнего Новгорода и Смоленска, 1995",
    "year": 1995,
    "channel": "ОРТ",
    "category": "news",
    "tags": ["ОРТ", "Нижний Новгород", "Смоленск", "региональные новости"],
    "curatorNote": "Публичный пост Орбиты-4 с YouTube-ссылкой и описанием репортажей.",
    "rightsRisk": "high",
    "status": "candidate"
  },
  {
    "id": "orbita4-davis-cup-chesnokov-sampras-1995",
    "source": "youtube",
    "sourceUrl": "https://t.me/s/orbita_4/312",
    "youtubeVideoId": "-YdWcRYa5lU",
    "title": "Кубок Дэвиса: Чесноков против Сампраса, 1995",
    "year": 1995,
    "channel": "ОРТ",
    "category": "sports",
    "tags": ["ОРТ", "Кубок Дэвиса", "Андрей Чесноков", "Пит Сампрас"],
    "curatorNote": "Публичный пост Орбиты-4 с YouTube-ссылкой и описанием трансляции.",
    "rightsRisk": "high",
    "status": "candidate"
  },
  {
    "id": "orbita4-yeltsin-1996-snipers",
    "source": "youtube",
    "sourceUrl": "https://t.me/s/orbita_4/241",
    "youtubeVideoId": "l_uhLXAN22k",
    "title": "Ельцин и 38 снайперов. ОРТ, 13 января 1996",
    "year": 1996,
    "airDate": "1996-01-13",
    "channel": "ОРТ",
    "category": "news",
    "tags": ["ОРТ", "Ельцин", "Первая чеченская", "новости"],
    "curatorNote": "Публичный пост Орбиты-4 с YouTube-ссылкой и датой эфира.",
    "rightsRisk": "high",
    "status": "candidate"
  },
  {
    "id": "orbita4-sosedov-tv6-1997",
    "source": "youtube",
    "sourceUrl": "https://t.me/s/orbita_4/227",
    "youtubeVideoId": "TO1U0X974X0",
    "title": "Сергей Соседов на ТВ-6, 1997",
    "year": 1997,
    "channel": "ТВ-6",
    "category": "talk",
    "tags": ["ТВ-6", "Сергей Соседов", "Алена Апина", "интервью"],
    "curatorNote": "Публичный пост Орбиты-4 с YouTube-ссылкой и описанием фрагмента.",
    "rightsRisk": "high",
    "status": "candidate"
  },
  {
    "id": "orbita4-akuly-politpera-gorbachev-1997",
    "source": "youtube",
    "sourceUrl": "https://t.me/s/orbita_4/228",
    "youtubeVideoId": "9cwvclVIZx0",
    "title": "Акулы политпера: Горбачев и Александр Невский, 1997",
    "year": 1997,
    "channel": "ТВ-6",
    "category": "talk",
    "tags": ["ТВ-6", "Акулы политпера", "Михаил Горбачев", "Александр Невский"],
    "curatorNote": "Публичный пост Орбиты-4 с YouTube-ссылкой и годом.",
    "rightsRisk": "high",
    "status": "candidate"
  },
  {
    "id": "orbita4-cafe-oblomov-neubauten-1997",
    "source": "youtube",
    "sourceUrl": "https://t.me/s/orbita_4/247",
    "youtubeVideoId": "M-jjMMpQH_g",
    "title": "Кафе Обломов: Einstuerzende Neubauten, РТР, 1997",
    "year": 1997,
    "channel": "РТР",
    "category": "music",
    "tags": ["РТР", "Кафе Обломов", "Артемий Троицкий", "музыка"],
    "curatorNote": "Публичный пост Орбиты-4 с YouTube-ссылкой и описанием передачи.",
    "rightsRisk": "high",
    "status": "candidate"
  },
  {
    "id": "orbita4-perehvat-ntv-1997",
    "source": "youtube",
    "sourceUrl": "https://t.me/s/orbita_4/276",
    "youtubeVideoId": "2PRGw6kXhT0",
    "title": "Шоу Перехват, НТВ, 1997",
    "year": 1997,
    "channel": "НТВ",
    "category": "gameshow",
    "tags": ["НТВ", "Перехват", "Николай Фоменко", "авто"],